{
    "$schema": "http://json-schema.org/draft-07/schema#",
    "title": "UASZoneVersion",
    "type": "object",
    "properties": {
        "identifier": {
            "type": "string",
            "maxLength": 7
        },
        "country": {
            "type": "string",
            "minLength": 3,
            "maxLength": 3
        },
        "name": {
            "type": "array",
            "items": {
                "minItems": 1,
                "$ref": "./Schema_GeoZoneDataTypes.json#/definitions/textShortType"
            }
        },
        "type": {"$ref": "./Schema_GeoZoneDataTypes.json#/definitions/zoneType"},
        "variant": {"$ref": "./Schema_GeoZoneDataTypes.json#/definitions/zoneVariant"},
        "restrictionConditions": {"type": "string"},
        "region": {"type": "integer"},
        "reason": {"$ref": "./Schema_GeoZoneDataTypes.json#/definitions/zoneReason"},
        "otherReasonInfo": {
            "type": "array",
            "items": {
                "minItems": 1,
                "$ref": "./Schema_GeoZoneDataTypes.json#/definitions/textShortType"
            }
        },
        "regulationExemption": {"$ref": "./Schema_GeoZoneDataTypes.json#/definitions/yesNoType"},
        "message": {
            "type": "array",
            "items": {
                "minItems": 1,
                "$ref": "./Schema_GeoZoneDataTypes.json#/definitions/textShortType"
            }
        },
        "zoneAuthority": {
            "type": "array",
            "items": {"$ref": "./Schema_GeoZoneAuthority.json"},
            "minItems": 1
        },
        "limitedApplicability": {
            "type": "array",
            "items": {"$ref": "./Schema_GeoZoneTimePeriod.json"}
        },
        "dataSource": {"$ref": "./Schema_GeoZoneDataTypes.json#/definitions/metadata"},
        "extendedProperties": {"type": "object"}
    },
    "required": [
        "identifier",
        "country",
        "type",
        "variant",
        "zoneAuthority"
    ],
    "additionalProperties": false
}